[{"decision_id":"DEC-CANDIDATE-001","decision_type":"APPROVE","subject_ref":"CRQ-01","scope":"candidate linkage schema","authority_ref":"CANDIDATE-GOVERNANCE-PLACEHOLDER","decision":"CONDITIONAL","effective_revision":"candidate-v0.1","evidence_refs":["RAG-01-SYNTHETIC"],"conditions":["not canonical","human approval required"],"supersedes":null,"reason":"synthetic governance fixture"}]